{
  "$schema": "../schema/metric.schema.json",
  "version": "1.1.0",
  "updated": "2026-07-27",
  "about": "What each Docsbook metric MEANS for the business — not what it counts. An agent reading a number should be able to say what to do about it, what would make it lie, and which other metric has to be read alongside it before drawing a conclusion. `pairs_with` is the important part: most single metrics are ambiguous, and the ambiguity is what makes an agent give confidently wrong advice.",
  "metrics": [
    {
      "id": "dead_end_rate",
      "label": "Dead-end rate",
      "category": "retention",
      "formula": "dead_end_visits / (total_visits - bounce_visits)",
      "unit": "percent",
      "direction": "lower_is_better",
      "accuracy": "estimate",
      "plan": "pro",
      "business_meaning": "The share of people who tried to get something done in the docs and left with nothing.",
      "why_it_matters": "This is the closest thing to direct evidence that documentation is failing its readers. Unlike bounce rate it excludes people who never engaged, so every visit it counts is someone who made an effort — searched, asked the AI, or opened several pages — and still walked away empty-handed. Traffic going up while this goes up means the docs are getting worse, not better.",
      "benchmarks": {
        "good": 0.15,
        "warning": 0.3,
        "critical": 0.45
      },
      "confounders": [
        "Bot traffic inflates it badly — crawlers never copy code or fire exit beacons, so an unfiltered window reads near 100%. Docsbook excludes them by default.",
        "Visitors are identified by a hashed IP: a corporate NAT merges many readers into one, mobile networks split one reader across several. Read the trend, never quote it as an exact headcount.",
        "Below ~30 visits a single reader moves this by whole points. Docsbook withholds the percentage and reports counts instead; say 'not enough data' rather than quoting a number."
      ],
      "typical_causes": [
        "A question readers have that no page answers",
        "A page exists but does not actually answer the question it ranks for",
        "The answer exists but is not findable — wrong title, missing from navigation, absent from search"
      ],
      "recommended_actions": [
        {
          "when": "above_warning",
          "action": "Pull dead_end_pages and rewrite the top three by volume."
        },
        {
          "when": "rising_trend",
          "action": "Check whether a release shipped without docs — compare against the dates in the changelog."
        }
      ],
      "related_metrics": [
        "self_serve_resolution_rate",
        "exit_rate",
        "content_health_score"
      ],
      "pairs_with": [
        {
          "metric": "exit_rate",
          "interpretation": "High on both = a genuinely broken page. High exit with LOW dead-end = a terminal success page: readers got what they came for and left. Recommending a rewrite there makes the docs worse."
        },
        {
          "metric": "search_ctr",
          "interpretation": "Dead ends plus a low click-through means readers are finding results and rejecting them — the titles and snippets are lying, which is a far cheaper fix than rewriting the pages."
        }
      ],
      "mcp_patterns": [
        "visit_outcomes",
        "dead_end_pages"
      ]
    },
    {
      "id": "self_serve_resolution_rate",
      "label": "Self-serve resolution rate",
      "category": "retention",
      "formula": "success_visits / (success_visits + dead_end_visits)",
      "unit": "percent",
      "direction": "higher_is_better",
      "accuracy": "estimate",
      "plan": "pro",
      "business_meaning": "Of the readers who came with an intent, the share who resolved it without needing a human.",
      "why_it_matters": "This is the honest version of the support-deflection number a docs platform is usually bought for. It is the metric to quote to a buyer who asks 'how much support load will this save', because someone who gave up lands in the denominator and drags it down.",
      "benchmarks": {
        "good": 0.75,
        "warning": 0.55,
        "critical": 0.4
      },
      "confounders": [
        "Do NOT convert this into a deflection rate or a dollar figure on Docsbook's behalf. Deflection counts someone who gave up the same as someone who got help, which is exactly the inflation a technical buyer will catch.",
        "A dollar estimate is only defensible if the owner supplies their own cost-per-ticket. Present it as their assumption, never as our claim.",
        "Visitors are identified by a hashed IP: shared office networks merge readers into one, mobile networks split one reader across several. Report the direction of travel, not an exact count."
      ],
      "typical_causes": [
        "Answers exist but are split across pages, so no single visit completes",
        "The AI assistant cannot answer from the current content"
      ],
      "recommended_actions": [
        {
          "when": "below_warning",
          "action": "Cross-reference unanswered AI questions with zero-result searches; a topic appearing in both is a confirmed gap, not a one-off."
        }
      ],
      "related_metrics": [
        "dead_end_rate",
        "ai_answer_rate"
      ],
      "pairs_with": [
        {
          "metric": "dead_end_rate",
          "interpretation": "Two views of the same population. Quote resolution to a buyer (it sounds like value delivered) and dead-end to an author (it names work to do)."
        }
      ],
      "mcp_patterns": [
        "visit_outcomes"
      ]
    },
    {
      "id": "exit_rate",
      "label": "Exit rate",
      "category": "engagement",
      "formula": "visits_ending_on_page / visits_including_page",
      "unit": "percent",
      "direction": "context_dependent",
      "accuracy": "estimate",
      "plan": "pro",
      "business_meaning": "How often a page is the last thing a reader sees before leaving.",
      "why_it_matters": "It localises where readers are lost. On its own it is a neutral fact, not a verdict — which is precisely why it must never be reported alone.",
      "benchmarks": null,
      "confounders": [
        "A high exit rate is GOOD on a terminal page — an install snippet, a reference table someone copies. Judging pages by exit rate alone recommends breaking the best ones.",
        "Exit is recorded by a beacon at unload; a hard browser crash loses it, so absolute levels are slightly understated. Compare pages against each other, not against 100%.",
        "Visitors are identified by a hashed IP: shared office networks merge readers into one, mobile networks split one reader across several. Report the direction of travel, not an exact count.",
        "Bot traffic is excluded before this is computed; comparing it against raw pageview totals will not reconcile."
      ],
      "typical_causes": [
        "The reader finished",
        "The reader gave up",
        "The page is a dead end in the navigation"
      ],
      "recommended_actions": [
        {
          "when": "high_with_dead_ends",
          "action": "Rewrite: readers are leaving unsatisfied."
        },
        {
          "when": "high_with_successes",
          "action": "Leave it alone and study it — this is what a page that works looks like."
        }
      ],
      "related_metrics": [
        "dead_end_rate",
        "content_health_score"
      ],
      "pairs_with": [
        {
          "metric": "dead_end_rate",
          "interpretation": "The pairing that turns exit rate from trivia into a decision. Without it you cannot tell 'finished' from 'gave up'."
        }
      ],
      "mcp_patterns": [
        "exit_pages",
        "dead_end_pages"
      ]
    },
    {
      "id": "bounce_rate",
      "label": "Bounce rate",
      "category": "engagement",
      "formula": "bounce_visits / total_visits",
      "unit": "percent",
      "direction": "context_dependent",
      "accuracy": "estimate",
      "plan": "pro",
      "business_meaning": "The share of arrivals that were never really visits — one page, under three seconds, nothing else.",
      "why_it_matters": "Mostly a hygiene signal. It is deliberately excluded from the dead-end denominator so accidental arrivals cannot flatter or damage the headline number.",
      "benchmarks": null,
      "confounders": [
        "A high bounce rate on docs often means search-engine traffic landing on the wrong page, which is an SEO problem, not a content problem.",
        "Never present this as a failure of the reader. It is not a judgement, and treating it as one leads to pointless rewrites.",
        "Visitors are identified by a hashed IP: shared office networks merge readers into one, mobile networks split one reader across several. Report the direction of travel, not an exact count.",
        "Bot traffic is excluded before this is computed; comparing it against raw pageview totals will not reconcile."
      ],
      "typical_causes": [
        "Search traffic mismatched to the page",
        "Bot traffic that slipped past the filter",
        "A redirect landing readers somewhere unhelpful"
      ],
      "recommended_actions": [
        {
          "when": "rising_trend",
          "action": "Check which pages new arrivals land on and whether the titles match what they searched for."
        }
      ],
      "related_metrics": [
        "dead_end_rate"
      ],
      "pairs_with": [
        {
          "metric": "traffic",
          "interpretation": "A bounce spike alongside a traffic spike is usually a new inbound source landing on the wrong page — an SEO or referrer problem. Bounces rising while traffic is flat points at the entry pages themselves."
        }
      ],
      "mcp_patterns": [
        "visit_outcomes"
      ]
    },
    {
      "id": "time_to_first_value",
      "label": "Time to first value (TTFV)",
      "category": "activation",